{
  "$schema": "https://json-schema.org/draft/2020-12/schema",
  "title": "TableSnapshotMessage",
  "description": "Full table state for one receiver. Sent on connect and in reply to resync.request. Replaces everything the client holds; version is the room's current version.",
  "type": "object",
  "properties": {
    "protocol_version": {
      "$ref": "../common.schema.json#/$defs/ProtocolVersion"
    },
    "type": {
      "const": "table.snapshot"
    },
    "room_id": {
      "$ref": "../common.schema.json#/$defs/RoomId"
    },
    "hand_id": {
      "$ref": "../common.schema.json#/$defs/HandIdOrNull"
    },
    "version": {
      "$ref": "../common.schema.json#/$defs/Version"
    },
    "server_time": {
      "$ref": "../common.schema.json#/$defs/ServerTime"
    },
    "payload": {
      "type": "object",
      "properties": {
        "table": {
          "$ref": "../common.schema.json#/$defs/TableState"
        }
      },
      "required": [
        "table"
      ],
      "additionalProperties": false
    }
  },
  "required": [
    "protocol_version",
    "type",
    "room_id",
    "hand_id",
    "version",
    "server_time",
    "payload"
  ],
  "additionalProperties": false
}
