{
  "protocol_version": 1,
  "type": "table.snapshot",
  "room_id": 1,
  "hand_id": 41,
  "version": 23,
  "server_time": "2026-10-27T14:03:45.300Z",
  "payload": {
    "table": {
      "room": {
        "room_id": 1,
        "name": "Bàn bạn bè",
        "status": "playing",
        "max_seats": 9,
        "small_blind": 5,
        "big_blind": 10,
        "think_time_seconds": 20,
        "seven_deuce_bonus": 50,
        "starting_stack": 1000,
        "ante": 0,
        "bomb_pot_every": 0,
        "bomb_pot_amount": 0
      },
      "you": {
        "player_id": "4",
        "seat": null
      },
      "seats": [
        {
          "seat": 1,
          "player_id": "1",
          "display_name": "Lym",
          "stack": 1000,
          "sitting_out": false,
          "connected": true
        },
        {
          "seat": 3,
          "player_id": "2",
          "display_name": "An",
          "stack": 1000,
          "sitting_out": false,
          "connected": true
        },
        {
          "seat": 5,
          "player_id": "3",
          "display_name": "Bình",
          "stack": 1000,
          "sitting_out": false,
          "connected": true
        }
      ],
      "hand": {
        "hand_id": 41,
        "hand_no": 1,
        "button_seat": 1,
        "small_blind": 5,
        "big_blind": 10,
        "ante": 0,
        "bomb_pot": 0,
        "board": [
          "Ah",
          "8d",
          "Jc"
        ],
        "pots": [
          {
            "amount": 65,
            "eligible": [
              "3",
              "1"
            ]
          }
        ],
        "players": [
          {
            "player_id": "1",
            "seat": 1,
            "stack": 920,
            "bet": 50,
            "in_hand": true,
            "cards": [
              "7h",
              "2c"
            ]
          },
          {
            "player_id": "2",
            "seat": 3,
            "stack": 995,
            "bet": 0,
            "in_hand": false,
            "cards": []
          },
          {
            "player_id": "3",
            "seat": 5,
            "stack": 970,
            "bet": 0,
            "in_hand": true,
            "cards": [
              "9c",
              "9d"
            ]
          }
        ],
        "actor": "3",
        "legal_actions": null,
        "complete": false
      },
      "turn": {
        "player_id": "3",
        "seat": 5,
        "deadline": "2026-10-27T14:04:02.000Z",
        "think_time_seconds": 20
      }
    }
  }
}
